{
  "boundaries": [
    "Encoding-observed RSS is not a whole-cell process peak.",
    "Effectiveness is established only on the two fixed English BRIGHT tracks.",
    "No verified zero-shot or multilingual-effectiveness claim is allowed.",
    "The package is research-only and is not publication readiness evidence."
  ],
  "models": [
    {
      "dimensions": 50265,
      "document_route": "neural",
      "license": "Apache-2.0",
      "license_boundary": "Apache-2.0",
      "mechanism": "neural SPLADE masked-language-model expansion with role-specific top-k pruning",
      "model_key": "granite-30m-sparse",
      "parameter_count": null,
      "query_route": "neural",
      "repo_id": "ibm-granite/granite-embedding-30m-sparse",
      "revision": "ad82b1fd09541c998c8d45045d601c51fdb8a9b7",
      "snapshot_bytes": 63318503,
      "snapshot_bytes_kind": "frozen_estimate",
      "snapshot_identity_sha256": "392f7930e073c6025d3eefd1caa3eedc01789b3dfcb7d7bc734179ccb511afaa",
      "tracks": [
        {
          "batch": {
            "batch1_oom": false,
            "document_attempted": [
              8
            ],
            "document_used": [
              8
            ],
            "fallback_observed": false,
            "query_attempted": [
              8
            ],
            "query_used": 8,
            "requested": 8
          },
          "document_nnz": {
            "count": 7500,
            "empty": 0,
            "max": 192,
            "mean": 163.3032,
            "p50": 192.0,
            "p95": 192.0,
            "total": 1224774
          },
          "encoding": {
            "document_latency_ms": 14607.105363160372,
            "document_observed_rss_bytes": 1889099776,
            "document_peak_vram_bytes": 898789888,
            "document_throughput_items_per_second": 513.4487506960319,
            "query_latency_ms": 234.4100195914507,
            "query_observed_rss_bytes": 1952841728,
            "query_peak_vram_bytes": 898789888,
            "query_throughput_items_per_second": 439.4010127191533,
            "rss_scope": "encoding_observed_not_whole_cell_peak"
          },
          "exact_search_seconds": 0.8694914001971483,
          "query_nnz": {
            "count": 103,
            "empty": 0,
            "max": 50,
            "mean": 50.0,
            "p50": 50.0,
            "p95": 50.0,
            "total": 5150
          },
          "representation": {
            "document_csr_bytes": 9828196,
            "document_stored_bytes": 4108203,
            "index_bytes": 9828196,
            "query_csr_bytes": 41616,
            "query_stored_bytes": 19729
          },
          "track": "economics",
          "truncation": {
            "documents": 748,
            "queries": 2
          }
        },
        {
          "batch": {
            "batch1_oom": false,
            "document_attempted": [
              8
            ],
            "document_used": [
              8
            ],
            "fallback_observed": false,
            "query_attempted": [
              8
            ],
            "query_used": 8,
            "requested": 8
          },
          "document_nnz": {
            "count": 7500,
            "empty": 0,
            "max": 192,
            "mean": 161.35293333333334,
            "p50": 192.0,
            "p95": 192.0,
            "total": 1210147
          },
          "encoding": {
            "document_latency_ms": 14208.930032327771,
            "document_observed_rss_bytes": 1999667200,
            "document_peak_vram_bytes": 898789888,
            "document_throughput_items_per_second": 527.837070274553,
            "query_latency_ms": 194.83409263193607,
            "query_observed_rss_bytes": 2039848960,
            "query_peak_vram_bytes": 837663744,
            "query_throughput_items_per_second": 518.3897675998654,
            "rss_scope": "encoding_observed_not_whole_cell_peak"
          },
          "exact_search_seconds": 0.8548063822090626,
          "query_nnz": {
            "count": 101,
            "empty": 0,
            "max": 50,
            "mean": 50.0,
            "p50": 50.0,
            "p95": 50.0,
            "total": 5050
          },
          "representation": {
            "document_csr_bytes": 9711180,
            "document_stored_bytes": 4142816,
            "index_bytes": 9711180,
            "query_csr_bytes": 40808,
            "query_stored_bytes": 19648
          },
          "track": "psychology",
          "truncation": {
            "documents": 415,
            "queries": 0
          }
        }
      ]
    },
    {
      "dimensions": 30522,
      "document_route": "document_expansion",
      "license": "Apache-2.0",
      "license_boundary": "Apache-2.0",
      "mechanism": "static sparse query lookup plus neural document expansion",
      "model_key": "opensearch-doc-v2-mini",
      "parameter_count": null,
      "query_route": "static_lookup",
      "repo_id": "opensearch-project/opensearch-neural-sparse-encoding-doc-v2-mini",
      "revision": "4af867a426867dfdd744097531046f4289a32fdd",
      "snapshot_bytes": 94631975,
      "snapshot_bytes_kind": "frozen_estimate",
      "snapshot_identity_sha256": "46c91e3325d59555e2d848890835c276f406d96951c510ba25376e8c08c61458",
      "tracks": [
        {
          "batch": {
            "batch1_oom": false,
            "document_attempted": [
              8
            ],
            "document_used": [
              8
            ],
            "fallback_observed": false,
            "query_attempted": [
              8
            ],
            "query_used": 8,
            "requested": 8
          },
          "document_nnz": {
            "count": 7500,
            "empty": 0,
            "max": 883,
            "mean": 205.36,
            "p50": 180.0,
            "p95": 409.0,
            "total": 1540200
          },
          "encoding": {
            "document_latency_ms": 15549.707438796759,
            "document_observed_rss_bytes": 1656680448,
            "document_peak_vram_bytes": 1104987648,
            "document_throughput_items_per_second": 482.3241870961112,
            "query_latency_ms": 111.12379655241966,
            "query_observed_rss_bytes": 1731256320,
            "query_peak_vram_bytes": 103844864,
            "query_throughput_items_per_second": 926.8941774448151,
            "rss_scope": "encoding_observed_not_whole_cell_peak"
          },
          "exact_search_seconds": 0.9225831795483828,
          "query_nnz": {
            "count": 103,
            "empty": 0,
            "max": 243,
            "mean": 87.79611650485437,
            "p50": 77.0,
            "p95": 157.59999999999997,
            "total": 9043
          },
          "representation": {
            "document_csr_bytes": 12351604,
            "document_stored_bytes": 8410429,
            "index_bytes": 12351604,
            "query_csr_bytes": 72760,
            "query_stored_bytes": 35105
          },
          "track": "economics",
          "truncation": {
            "documents": 647,
            "queries": 0
          }
        },
        {
          "batch": {
            "batch1_oom": false,
            "document_attempted": [
              8
            ],
            "document_used": [
              8
            ],
            "fallback_observed": false,
            "query_attempted": [
              8
            ],
            "query_used": 8,
            "requested": 8
          },
          "document_nnz": {
            "count": 7500,
            "empty": 0,
            "max": 857,
            "mean": 203.70866666666666,
            "p50": 178.0,
            "p95": 416.0499999999993,
            "total": 1527815
          },
          "encoding": {
            "document_latency_ms": 15646.199483424425,
            "document_observed_rss_bytes": 1785712640,
            "document_peak_vram_bytes": 1104987648,
            "document_throughput_items_per_second": 479.34963426393074,
            "query_latency_ms": 93.78918260335922,
            "query_observed_rss_bytes": 1863614464,
            "query_peak_vram_bytes": 103841792,
            "query_throughput_items_per_second": 1076.8832523803499,
            "rss_scope": "encoding_observed_not_whole_cell_peak"
          },
          "exact_search_seconds": 0.9162330124527216,
          "query_nnz": {
            "count": 101,
            "empty": 0,
            "max": 207,
            "mean": 85.58415841584159,
            "p50": 79.0,
            "p95": 154.0,
            "total": 8644
          },
          "representation": {
            "document_csr_bytes": 12252524,
            "document_stored_bytes": 8440411,
            "index_bytes": 12252524,
            "query_csr_bytes": 69560,
            "query_stored_bytes": 33537
          },
          "track": "psychology",
          "truncation": {
            "documents": 387,
            "queries": 0
          }
        }
      ]
    },
    {
      "dimensions": 30522,
      "document_route": "document_expansion",
      "license": "Apache-2.0",
      "license_boundary": "Apache-2.0",
      "mechanism": "static sparse query lookup plus distilled neural document expansion",
      "model_key": "opensearch-doc-v3",
      "parameter_count": null,
      "query_route": "static_lookup",
      "repo_id": "opensearch-project/opensearch-neural-sparse-encoding-doc-v3-distill",
      "revision": "babf71f3c48695e2e53a978208e8aba48335e3c0",
      "snapshot_bytes": 271581184,
      "snapshot_bytes_kind": "frozen_estimate",
      "snapshot_identity_sha256": "55bf8e1df3905b6a4f81d7dd78402cf31088bd3db1a724baec8d5eace8b75151",
      "tracks": [
        {
          "batch": {
            "batch1_oom": false,
            "document_attempted": [
              8
            ],
            "document_used": [
              8
            ],
            "fallback_observed": false,
            "query_attempted": [
              8
            ],